{
  "$schema": "https://json-schema.org/draft/2020-12/schema",
  "title": "CitationPackage",
  "type": "object",
  "additionalProperties": false,
  "required": ["package_id", "run_id", "query_id", "created_at", "sources"],
  "properties": {
    "package_id": { "type": "string", "minLength": 1 },
    "run_id": { "type": "string", "minLength": 1 },
    "query_id": { "type": "string", "minLength": 1 },
    "created_at": { "type": "string", "format": "date-time" },
    "sources": {
      "type": "array",
      "items": {
        "type": "object",
        "additionalProperties": false,
        "required": [
          "source_id",
          "uri",
          "title",
          "excerpt",
          "content_type",
          "checksum",
          "version",
          "retrieved_at"
        ],
        "properties": {
          "source_id": { "type": "string", "minLength": 1 },
          "uri": { "type": "string", "minLength": 1 },
          "title": { "type": "string", "minLength": 1 },
          "excerpt": { "type": "string", "minLength": 1 },
          "content_type": { "type": "string", "minLength": 1 },
          "checksum": { "type": "string", "minLength": 1 },
          "version": { "type": "string", "minLength": 1 },
          "retrieved_at": { "type": "string", "format": "date-time" }
        }
      }
    }
  }
}
