{
  "package_id": "citation-package-001",
  "run_id": "01J8Y3H9ZV3EN8R1B0C1R2D3E4",
  "query_id": "query-ops-001",
  "created_at": "2024-01-01T00:00:00Z",
  "sources": [
    {
      "source_id": "source-ops-runbook",
      "uri": "https://example.com/ops/runbook.md",
      "title": "Operations Runbook",
      "excerpt": "Runbook guidance for incident response and escalation.",
      "content_type": "text/markdown",
      "checksum": "sha256:9d1a0c8e0f1f9e21",
      "version": "v2",
      "retrieved_at": "2024-01-01T00:00:00Z"
    }
  ]
}
